{
  "$schema": "http://json-schema.org/draft-07/schema#",
  "title": "appstore-precheck LLM eval case",
  "description": "One labelled evaluation case for Pierre's deep-review layer. Each case targets exactly one of the 31 checks, ships a minimal self-contained fixture, and carries a human-confirmed expected outcome. Cases with label_confirmed=false are counted as UNLABELED and excluded from headline metrics.",
  "type": "object",
  "required": [
    "id",
    "check_id",
    "tier",
    "guideline",
    "expected",
    "rationale",
    "label_confirmed",
    "fixture"
  ],
  "additionalProperties": false,
  "properties": {
    "id": {
      "type": "string",
      "pattern": "^check[0-9]{2}-[a-z0-9-]+$",
      "description": "Unique case id; must equal the case filename without .json"
    },
    "check_id": {
      "type": "integer",
      "minimum": 1,
      "maximum": 31,
      "description": "Target check number from pierre-deep-review.md (table order)"
    },
    "tier": {
      "enum": [
        "A",
        "B"
      ],
      "description": "Must match catalog: B for 4, 5, 7, 10, 15, 29, 30, 31; A otherwise"
    },
    "guideline": {
      "type": "string",
      "minLength": 1,
      "description": "Apple guideline reference as written in the check table, e.g. \"2.2\" or \"5.1.1(ii)\""
    },
    "expected": {
      "enum": [
        "finding",
        "pass",
        "not-applicable",
        "insufficient_evidence"
      ],
      "description": "finding = REVIEW-FINDING expected; pass = REVIEW-PASS expected; not-applicable = REVIEW-NOT-APPLICABLE (legacy v2: REVIEW-PASS with 'not applicable'); insufficient_evidence includes missing, unsupported or unexecuted inspection"
    },
    "rationale": {
      "type": "string",
      "minLength": 10,
      "description": "One-line human rationale for the label"
    },
    "label_confirmed": {
      "type": "boolean",
      "description": "true only after a human has reviewed fixture + label; false = UNLABELED in the scorecard"
    },
    "fixture": {
      "type": "string",
      "pattern": "^fixtures/[a-z0-9-]+/$",
      "description": "Fixture directory relative to eval/dataset/, trailing slash required"
    },
    "fetched_urls": {
      "type": "object",
      "additionalProperties": {
        "type": "string"
      },
      "description": "Pre-fetched URL contents keyed by kind (e.g. privacy, support). Substitutes Pierre's live WebFetch so eval runs are deterministic and offline-scoreable."
    },
    "notes": {
      "type": "string",
      "description": "Optional free-form notes for maintainers (not sent to the model)"
    },
    "check_key": {
      "type": "string",
      "description": "Stable identity from references/review-catalog.json; must match check_id"
    },
    "catalog_version": {
      "type": "integer",
      "enum": [
        2,
        3
      ],
      "description": "Absent means frozen catalog v2; use 3 explicitly for corrected mappings."
    }
  }
}
